{
  "schemaVersion": 1,
  "unitId": "chapter-when-trust-stops-tracking-reality-parts-part-2-the-first-cracks-chapter-4-warnings-become-easier-to-ignore",
  "generationHash": "sha256:36781330e258475be856d4f206bdae8c0c360485dcf0007c514652acec475d89",
  "granularity": "segment-only",
  "segments": [
    {
      "id": "s0001",
      "text": "Warnings Become Easier to Ignore",
      "startMs": 0.0,
      "endMs": 2217.0,
      "charStart": 0,
      "charEnd": 32
    },
    {
      "id": "s0002",
      "text": "> Why do warning signs become harder to see?",
      "startMs": 2275.0,
      "endMs": 5631.0,
      "charStart": 34,
      "charEnd": 78
    },
    {
      "id": "s0003",
      "text": "Real warning signs almost never announce themselves.",
      "startMs": 5956.0,
      "endMs": 9183.0,
      "charStart": 80,
      "charEnd": 132
    },
    {
      "id": "s0004",
      "text": "They arrive as something easier to dismiss—a handful of patient complaints, a process that misfires once, clinics handling the same situation differently despite shared procedures.",
      "startMs": 9566.0,
      "endMs": 20549.0,
      "charStart": 133,
      "charEnd": 313
    },
    {
      "id": "s0005",
      "text": "Only later does anyone recognize what those fragments meant.",
      "startMs": 20874.0,
      "endMs": 24554.0,
      "charStart": 314,
      "charEnd": 374
    },
    {
      "id": "s0006",
      "text": "When Walter Pruitt, who had joined Calder during its period of rapid expansion, began noticing such concerns, the organization was still succeeding—outcomes mostly positive, the mission intact, trust largely deserved.",
      "startMs": 25251.0,
      "endMs": 40042.0,
      "charStart": 376,
      "charEnd": 593
    },
    {
      "id": "s0007",
      "text": "He remembered when problems were easier to see because fewer layers existed between decisions and outcomes.",
      "startMs": 40553.0,
      "endMs": 46753.0,
      "charStart": 594,
      "charEnd": 701
    },
    {
      "id": "s0008",
      "text": "That backdrop made weak signals hard to see.",
      "startMs": 47566.0,
      "endMs": 50492.0,
      "charStart": 702,
      "charEnd": 746
    },
    {
      "id": "s0009",
      "text": "None of the issues seemed significant on its own.",
      "startMs": 51188.0,
      "endMs": 53731.0,
      "charStart": 747,
      "charEnd": 796
    },
    {
      "id": "s0010",
      "text": "Walter did not treat them as proof Calder was failing.",
      "startMs": 54543.0,
      "endMs": 57458.0,
      "charStart": 797,
      "charEnd": 851
    },
    {
      "id": "s0011",
      "text": "He treated them as signals worth investigating.",
      "startMs": 57899.0,
      "endMs": 60650.0,
      "charStart": 852,
      "charEnd": 899
    },
    {
      "id": "s0012",
      "text": "Most colleagues heard something milder.",
      "startMs": 61463.0,
      "endMs": 63599.0,
      "charStart": 901,
      "charEnd": 940
    },
    {
      "id": "s0013",
      "text": "Complaints seemed isolated.",
      "startMs": 63982.0,
      "endMs": 65840.0,
      "charStart": 941,
      "charEnd": 968
    },
    {
      "id": "s0014",
      "text": "Failures looked temporary.",
      "startMs": 66084.0,
      "endMs": 67709.0,
      "charStart": 969,
      "charEnd": 995
    },
    {
      "id": "s0015",
      "text": "Outcomes remained overwhelmingly positive.",
      "startMs": 68034.0,
      "endMs": 70693.0,
      "charStart": 996,
      "charEnd": 1038
    },
    {
      "id": "s0016",
      "text": "Against years of successful care and a mission people believed in, each fragment felt small.",
      "startMs": 71134.0,
      "endMs": 76811.0,
      "charStart": 1039,
      "charEnd": 1131
    },
    {
      "id": "s0017",
      "text": "The existing story seemed more convincing than the new evidence.",
      "startMs": 77090.0,
      "endMs": 80701.0,
      "charStart": 1132,
      "charEnd": 1196
    },
    {
      "id": "s0018",
      "text": "Fragments rarely ask people to overturn trust.",
      "startMs": 81084.0,
      "endMs": 83905.0,
      "charStart": 1198,
      "charEnd": 1244
    },
    {
      "id": "s0019",
      "text": "They ask to be filed away as exceptions—and when trust has been earned, filing them away often feels like patience rather than denial.",
      "startMs": 84056.0,
      "endMs": 92044.0,
      "charStart": 1245,
      "charEnd": 1379
    },
    {
      "id": "s0020",
      "text": "Patience and dismissal can look remarkably similar while warning signs are still weak.",
      "startMs": 92253.0,
      "endMs": 97303.0,
      "charStart": 1380,
      "charEnd": 1466
    },
    {
      "id": "s0021",
      "text": "The difference usually appears only later.",
      "startMs": 97686.0,
      "endMs": 99927.0,
      "charStart": 1467,
      "charEnd": 1509
    },
    {
      "id": "s0022",
      "text": "The pattern appears in intimate relationships too.",
      "startMs": 100101.0,
      "endMs": 102899.0,
      "charStart": 1511,
      "charEnd": 1561
    },
    {
      "id": "s0023",
      "text": "A spouse may notice recurring friction but file it away as a bad week.",
      "startMs": 103178.0,
      "endMs": 107485.0,
      "charStart": 1562,
      "charEnd": 1632
    },
    {
      "id": "s0024",
      "text": "A long friendship may show small shifts in availability that feel too minor to name against years of loyalty.",
      "startMs": 107810.0,
      "endMs": 114323.0,
      "charStart": 1633,
      "charEnd": 1742
    },
    {
      "id": "s0025",
      "text": "The signals are present.",
      "startMs": 114439.0,
      "endMs": 115623.0,
      "charStart": 1743,
      "charEnd": 1767
    },
    {
      "id": "s0026",
      "text": "They simply do not look like warnings yet.",
      "startMs": 115705.0,
      "endMs": 118085.0,
      "charStart": 1768,
      "charEnd": 1810
    },
    {
      "id": "s0027",
      "text": "Before the Challenger disaster, engineers raised concerns about O-ring performance under unusually cold conditions.",
      "startMs": 118363.0,
      "endMs": 124749.0,
      "charStart": 1812,
      "charEnd": 1927
    },
    {
      "id": "s0028",
      "text": "The concerns were real, but they looked like technical caveats against successful launches—not alarms demanding a halt.",
      "startMs": 124865.0,
      "endMs": 131622.0,
      "charStart": 1928,
      "charEnd": 2047
    },
    {
      "id": "s0029",
      "text": "Before the Boeing 737 MAX accidents, concerns emerged about design decisions, pilot assumptions, and safety processes.",
      "startMs": 131865.0,
      "endMs": 140132.0,
      "charStart": 2049,
      "charEnd": 2167
    },
    {
      "id": "s0030",
      "text": "Each competed with decades of engineering credibility rather than with an obvious crisis.",
      "startMs": 140376.0,
      "endMs": 145322.0,
      "charStart": 2168,
      "charEnd": 2257
    },
    {
      "id": "s0031",
      "text": "Before Theranos collapsed, journalists, employees, and experts raised questions that struggled against a narrative of innovation and success.",
      "startMs": 145705.0,
      "endMs": 154459.0,
      "charStart": 2259,
      "charEnd": 2400
    },
    {
      "id": "s0032",
      "text": "The questions existed early.",
      "startMs": 154668.0,
      "endMs": 156386.0,
      "charStart": 2401,
      "charEnd": 2429
    },
    {
      "id": "s0033",
      "text": "They simply did not look like the beginning of collapse.",
      "startMs": 156595.0,
      "endMs": 159265.0,
      "charStart": 2430,
      "charEnd": 2486
    },
    {
      "id": "s0034",
      "text": "At Calder, nothing yet demanded a different conclusion—but fragments had appeared, and the organization was treating them as exceptions rather than signals.",
      "startMs": 159649.0,
      "endMs": 168588.0,
      "charStart": 2488,
      "charEnd": 2644
    },
    {
      "id": "s0035",
      "text": "Trust had once helped people learn from success.",
      "startMs": 168913.0,
      "endMs": 171549.0,
      "charStart": 2646,
      "charEnd": 2694
    },
    {
      "id": "s0036",
      "text": "Now it was helping them explain away the first signs that success might no longer tell the whole story.",
      "startMs": 171990.0,
      "endMs": 177482.0,
      "charStart": 2695,
      "charEnd": 2798
    },
    {
      "id": "s0037",
      "text": "Core Principle",
      "startMs": 178295.0,
      "endMs": 179247.0,
      "charStart": 2800,
      "charEnd": 2814
    },
    {
      "id": "s0038",
      "text": "Trust Can Silence Weak Signals",
      "startMs": 179293.0,
      "endMs": 182834.0,
      "charStart": 2816,
      "charEnd": 2846
    },
    {
      "id": "s0039",
      "text": "Weak signals rarely look like warnings—and trust often absorbs them before stronger evidence arrives.",
      "startMs": 183786.0,
      "endMs": 190404.0,
      "charStart": 2848,
      "charEnd": 2949
    }
  ]
}
