{
  "schemaVersion": 1,
  "unitId": "chapter-observer-patterns-parts-part-iv-what-moves-together-why-diversity-matters-when-others-look-to-you",
  "generationHash": "sha256:ec12b97636725e2bd3cfa11fb191feb72a2556757f3c97bcdd7fb56b8df95597",
  "granularity": "segment-only",
  "segments": [
    {
      "id": "s0001",
      "text": "Why Diversity Matters When Others Look To You",
      "startMs": 0.0,
      "endMs": 2403.0,
      "charStart": 0,
      "charEnd": 45
    },
    {
      "id": "s0002",
      "text": "Difference is encountered.",
      "startMs": 3518.0,
      "endMs": 5016.0,
      "charStart": 47,
      "charEnd": 73
    },
    {
      "id": "s0003",
      "text": "Attention finds a focus.",
      "startMs": 5341.0,
      "endMs": 7140.0,
      "charStart": 75,
      "charEnd": 99
    },
    {
      "id": "s0004",
      "text": "Variation accumulates.",
      "startMs": 7465.0,
      "endMs": 9207.0,
      "charStart": 101,
      "charEnd": 123
    },
    {
      "id": "s0005",
      "text": "Examples accumulate.",
      "startMs": 9590.0,
      "endMs": 11018.0,
      "charStart": 125,
      "charEnd": 145
    },
    {
      "id": "s0006",
      "text": "Perspective expands.",
      "startMs": 11227.0,
      "endMs": 12759.0,
      "charStart": 147,
      "charEnd": 167
    },
    {
      "id": "s0007",
      "text": "Leadership coalesces.",
      "startMs": 13038.0,
      "endMs": 14536.0,
      "charStart": 169,
      "charEnd": 190
    },
    {
      "id": "s0008",
      "text": "Dissent is welcomed.",
      "startMs": 14779.0,
      "endMs": 16091.0,
      "charStart": 192,
      "charEnd": 212
    },
    {
      "id": "s0009",
      "text": "Disagreement is suppressed.",
      "startMs": 16300.0,
      "endMs": 17856.0,
      "charStart": 213,
      "charEnd": 240
    },
    {
      "id": "s0010",
      "text": "Assumptions are tested.",
      "startMs": 18065.0,
      "endMs": 19470.0,
      "charStart": 241,
      "charEnd": 264
    },
    {
      "id": "s0011",
      "text": "Understanding fragments.",
      "startMs": 19679.0,
      "endMs": 21293.0,
      "charStart": 265,
      "charEnd": 289
    },
    {
      "id": "s0012",
      "text": "Feedback drives change.",
      "startMs": 21676.0,
      "endMs": 23475.0,
      "charStart": 290,
      "charEnd": 313
    },
    {
      "id": "s0013",
      "text": "Exceptions are forever.",
      "startMs": 23626.0,
      "endMs": 25205.0,
      "charStart": 314,
      "charEnd": 337
    },
    {
      "id": "s0014",
      "text": "Understanding deepens.",
      "startMs": 25530.0,
      "endMs": 27155.0,
      "charStart": 338,
      "charEnd": 360
    },
    {
      "id": "s0015",
      "text": "Division forms.",
      "startMs": 27364.0,
      "endMs": 28572.0,
      "charStart": 361,
      "charEnd": 376
    },
    {
      "id": "s0016",
      "text": "Leaders feel the consequences.",
      "startMs": 28781.0,
      "endMs": 30650.0,
      "charStart": 377,
      "charEnd": 407
    },
    {
      "id": "s0017",
      "text": "Learning stalls.",
      "startMs": 30859.0,
      "endMs": 32101.0,
      "charStart": 408,
      "charEnd": 424
    },
    {
      "id": "s0018",
      "text": "Common ground forms.",
      "startMs": 32252.0,
      "endMs": 33669.0,
      "charStart": 425,
      "charEnd": 445
    },
    {
      "id": "s0019",
      "text": "Learning collapses.",
      "startMs": 33785.0,
      "endMs": 35027.0,
      "charStart": 446,
      "charEnd": 465
    },
    {
      "id": "s0020",
      "text": "Resilience grows.",
      "startMs": 35143.0,
      "endMs": 36432.0,
      "charStart": 466,
      "charEnd": 483
    },
    {
      "id": "s0021",
      "text": "Exclusion is reinforced.",
      "startMs": 36583.0,
      "endMs": 38382.0,
      "charStart": 484,
      "charEnd": 508
    },
    {
      "id": "s0022",
      "text": "Inclusion is practiced.",
      "startMs": 38556.0,
      "endMs": 40240.0,
      "charStart": 509,
      "charEnd": 532
    },
    {
      "id": "s0023",
      "text": "Fragility increases.",
      "startMs": 40449.0,
      "endMs": 42144.0,
      "charStart": 533,
      "charEnd": 553
    },
    {
      "id": "s0024",
      "text": "Learning accelerates.",
      "startMs": 42318.0,
      "endMs": 43653.0,
      "charStart": 554,
      "charEnd": 575
    },
    {
      "id": "s0025",
      "text": "Leadership reproduces itself.",
      "startMs": 43827.0,
      "endMs": 46010.0,
      "charStart": 577,
      "charEnd": 606
    },
    {
      "id": "s0026",
      "text": "What persists reflects what was included.",
      "startMs": 46138.0,
      "endMs": 49040.0,
      "charStart": 608,
      "charEnd": 649
    }
  ]
}
